{
  "schemaVersion": 1,
  "scenario": "orders-platform",
  "description": "orders service (3 APIs) on its own node pool; DynamoDB + S3; inventory and ledger (Aurora) on a shared node pool",
  "region": "us-east-1",
  "reportUnit": "USD/month",
  "period": {
    "hours": 730,
    "steps": 730
  },
  "total": 4815.88,
  "used": 3530.91,
  "idle": 1284.96,
  "fixed": 0,
  "tree": {
    "name": "orders-platform",
    "kind": "root",
    "cost": 4815.88,
    "share": 1,
    "children": [
      {
        "name": "orders",
        "kind": "service",
        "cost": 3530.91,
        "share": 0.733182,
        "children": [
          {
            "name": "createOrder",
            "kind": "request",
            "cost": 2296.31,
            "share": 0.47682,
            "children": [
              {
                "name": "dynamodb:orders",
                "kind": "offering",
                "cost": 975.85,
                "share": 0.202632,
                "children": [
                  {
                    "name": "write",
                    "kind": "request",
                    "cost": 975.85,
                    "share": 0.202632,
                    "children": [
                      {
                        "name": "aws.dynamodb.ondemand.wru",
                        "kind": "dimension",
                        "cost": 975.85,
                        "share": 0.202632,
                        "usage": 1561360000,
                        "unit": "op"
                      }
                    ]
                  }
                ]
              },
              {
                "name": "ledger",
                "kind": "service",
                "cost": 675.627,
                "share": 0.140292,
                "children": [
                  {
                    "name": "record",
                    "kind": "request",
                    "cost": 675.627,
                    "share": 0.140292,
                    "children": [
                      {
                        "name": "aurora-postgresql:ledger",
                        "kind": "offering",
                        "cost": 669.433,
                        "share": 0.139005,
                        "children": [
                          {
                            "name": "query",
                            "kind": "request",
                            "cost": 669.433,
                            "share": 0.139005,
                            "children": [
                              {
                                "name": "aws.aurora.io",
                                "kind": "dimension",
                                "cost": 624.544,
                                "share": 0.129684,
                                "usage": 3122720000,
                                "unit": "op"
                              },
                              {
                                "name": "aurora:ledger",
                                "kind": "pool",
                                "cost": 44.8891,
                                "share": 0.00932107,
                                "children": [
                                  {
                                    "name": "aws.aurora-postgresql.db.r7g.large.hours",
                                    "kind": "dimension",
                                    "cost": 44.8891,
                                    "share": 0.00932107,
                                    "usage": 162.642,
                                    "unit": "hour"
                                  }
                                ]
                              }
                            ]
                          }
                        ]
                      },
                      {
                        "name": "ledger",
                        "kind": "pool",
                        "cost": 6.1934,
                        "share": 0.00128604,
                        "children": [
                          {
                            "name": "aws.ec2.m7g.xlarge.hours",
                            "kind": "dimension",
                            "cost": 6.1934,
                            "share": 0.00128604,
                            "usage": 37.9497,
                            "unit": "hour"
                          }
                        ]
                      }
                    ]
                  }
                ]
              },
              {
                "name": "s3:receipts",
                "kind": "offering",
                "cost": 585.51,
                "share": 0.121579,
                "children": [
                  {
                    "name": "put",
                    "kind": "request",
                    "cost": 585.51,
                    "share": 0.121579,
                    "children": [
                      {
                        "name": "aws.s3.standard.put",
                        "kind": "dimension",
                        "cost": 585.51,
                        "share": 0.121579,
                        "usage": 117102000,
                        "unit": "req"
                      }
                    ]
                  }
                ]
              },
              {
                "name": "cross-az",
                "kind": "network",
                "cost": 31.2272,
                "share": 0.00648422,
                "children": [
                  {
                    "name": "aws.transfer.inter-az",
                    "kind": "dimension",
                    "cost": 31.2272,
                    "share": 0.00648422,
                    "usage": 3122.72,
                    "unit": "GB"
                  }
                ]
              },
              {
                "name": "orders-api",
                "kind": "pool",
                "cost": 24.3312,
                "share": 0.00505229,
                "children": [
                  {
                    "name": "aws.ec2.m7g.2xlarge.hours",
                    "kind": "dimension",
                    "cost": 24.3312,
                    "share": 0.00505229,
                    "usage": 74.5441,
                    "unit": "hour"
                  }
                ]
              },
              {
                "name": "inventory",
                "kind": "service",
                "cost": 3.76028,
                "share": 0.000780808,
                "children": [
                  {
                    "name": "reserve",
                    "kind": "request",
                    "cost": 3.76028,
                    "share": 0.000780808,
                    "children": [
                      {
                        "name": "inventory",
                        "kind": "pool",
                        "cost": 3.76028,
                        "share": 0.000780808,
                        "children": [
                          {
                            "name": "aws.ec2.m7g.xlarge.hours",
                            "kind": "dimension",
                            "cost": 3.76028,
                            "share": 0.000780808,
                            "usage": 23.0409,
                            "unit": "hour"
                          }
                        ]
                      }
                    ]
                  }
                ]
              }
            ]
          },
          {
            "name": "gauges",
            "kind": "gauges",
            "cost": 482.71,
            "share": 0.100233,
            "children": [
              {
                "name": "dynamodb:orders",
                "kind": "offering",
                "cost": 378.743,
                "share": 0.0786447,
                "children": [
                  {
                    "name": "gauges",
                    "kind": "gauges",
                    "cost": 378.743,
                    "share": 0.0786447,
                    "children": [
                      {
                        "name": "stored",
                        "kind": "gauge",
                        "cost": 378.743,
                        "share": 0.0786447,
                        "children": [
                          {
                            "name": "aws.dynamodb.storage",
                            "kind": "dimension",
                            "cost": 378.743,
                            "share": 0.0786447,
                            "usage": 1539.97,
                            "unit": "GB*month"
                          }
                        ]
                      }
                    ]
                  }
                ]
              },
              {
                "name": "s3:receipts",
                "kind": "offering",
                "cost": 53.129,
                "share": 0.0110321,
                "children": [
                  {
                    "name": "gauges",
                    "kind": "gauges",
                    "cost": 53.129,
                    "share": 0.0110321,
                    "children": [
                      {
                        "name": "stored",
                        "kind": "gauge",
                        "cost": 53.129,
                        "share": 0.0110321,
                        "children": [
                          {
                            "name": "aws.s3.standard.storage",
                            "kind": "dimension",
                            "cost": 53.129,
                            "share": 0.0110321,
                            "usage": 2309.96,
                            "unit": "GB*month"
                          }
                        ]
                      }
                    ]
                  }
                ]
              },
              {
                "name": "inventory",
                "kind": "service",
                "cost": 27.7385,
                "share": 0.00575981,
                "children": [
                  {
                    "name": "gauges",